gene	entrez_id	variant	disease	doid	drug	pubchem_id	evidence_type	evidence_direction	clinical_significance	statement	pubmed_id	citation	rating
TSC2	7249	LOSS-OF-FUNCTION	bladder carcinoma	4007	Everolimus		Predictive	Supports	Sensitivity	Tumors expressing TSC1 or TSC2 mutations show notably more sensitivity to everolimus than their wild-type counterparts.	23071027		3
TSC1	7248	LOSS-OF-FUNCTION	bladder carcinoma	4007	Everolimus		Predictive	Supports	Sensitivity	Tumors expressing TSC1 or TSC2 mutations show notably more sensitivity to everolimus than their wild-type counterparts.	23071027		3
TSC1	7248	FRAMESHIFT TRUNCATION	invasive bladder transitional cell carcinoma	6477	Everolimus		Predictive	Supports	Sensitivity	A patient with metastatic bladder cancer that responded well to the mTOR inhibitor everolimus was shown to harbor a TSC1 frameshift truncation mutation (c.1907_1908del, p.Glu636fs) and a nonsense NF2 mutation. 2/3 additional patients with TSC1 mutations also had mild responses to everolimus.	22923433	Iyer et al., 2012, Science	3
TSC1	7248	FRAMESHIFT TRUNCATION	non-small cell lung carcinoma	3908	Rapamycin		Predictive	Supports	Sensitivity	Following rapamycin treatment of mice with KrasG12D-induced lung tumors, mice with Tsc1 deletion (exon17/18 deletion resulting in frameshift) in the lung exhibit increased overall survival, increased apoptosis, reduced proliferation and reduced tumor burden compared to Tsc1 wildtype mice.	19966866	Liang et al., 2010, Oncogene	3
PTEN	5728	R233*	breast cancer	1612	N/A		Predictive	Supports	Sensitivity	Cells with PTEN deficiency have been shown to exhibit slowed growth in reponse to PI3K-mTOR inhibitors.	20085938	Courtney et al., 2010, J. Clin. Oncol.	4
PTEN	5728	R233*	glioblastoma multiforme	3068	N/A		Prognostic	Supports	Poor Outcome	PTEN nonsense  , including R233*, has been shown to be inactivating and loss-of-function, but do not have prognostic value in glioblastoma multiforme patients.	22479427	Carico et al., 2012, PLoS ONE	3
BRAF	673	V600D	melanoma	1909	Dabrafenib		Predictive	Supports	Sensitivity	Patients with other BRAF V600 mutations also respond well to the V600E drug dabrafenib.	23463675	Ponti et al., 2013, J. Clin. Pathol.	5
BRAF	673	V600M	melanoma	1909	Dabrafenib		Predictive	Supports	Sensitivity	Patients with other BRAF V600 mutations also respond well to the V600E drug dabrafenib.	23463675	Ponti et al., 2013, J. Clin. Pathol.	5
BRAF	673	V600R	melanoma	1909	Dabrafenib		Predictive	Supports	Sensitivity	Patients with other BRAF V600 mutations also respond well to the V600E drug dabrafenib.	23463675	Ponti et al., 2013, J. Clin. Pathol.	5
BRAF	673	V600E/V600M	melanoma	1909	Dabrafenib		Predictive	Supports	Sensitivity	A single patient with BRAF V600E/V600M bi-allelic mutation responded to the V600E drug dabrafenib.	23031422	Ponti et al., 2012, J Hematol Oncol	3
NPM1	4869	EXON 12	acute myeloid leukemia	9119	N/A		Prognostic	Supports	Better Outcome	Complete remission rates were higher and event-free survival was longer for normal karyotype AML patients with Exon 12 NPM1  .	16076867	Schnittger et al., 2005, Blood	5
NPM1	4869	EXON 12	acute myeloid leukemia	9119	N/A		Diagnostic	Supports	Negative	NPM1 mutations were not associated with M2 FAB subtypes	16076867	Schnittger et al., 2005, Blood	4
NPM1	4869	EXON 12	acute myeloid leukemia	9119	N/A		Diagnostic	Supports	Positive	NPM1 mutations were associated with M4, M5a and M5b FAB subtypes	16076867	Schnittger et al., 2005, Blood	4
NPM1	4869	EXON 12	acute myeloid leukemia	9119	N/A		Predictive	Supports	Sensitivity	NPM1 mutation without FLT3-ITD was associated with reduced relapse risk and increased overall survival in young adult AML patients (median age 43)	17957027	Gale et al., 2008, Blood	4
NPM1	4869	EXON 12	acute myeloid leukemia	9119	N/A		Prognostic	Does Not Support	N/A	In young AML patients (<60 years old), DNMT3A mutation status was not predictive of overall and relapse free survival in patients with NPM1 mutations and wildtype FLT3 or wildtype NPM1 and FLT3-ITD	22490330	Ribeiro et al., 2012, Blood	4
NPM1	4869	EXON 12	acute myeloid leukemia	9119	N/A		Prognostic	Supports	Better Outcome	Younger (16-60), normal karyotype AML patients with Exon 12 NPM1 mutation and without FLT3-ITD have increased overall survival, relapse-free survival and response to induction chemotherapy	16051734	Döhner et al., 2005, Blood	4
NPM1	4869	EXON 12	acute myeloid leukemia	9119	N/A		Prognostic	Supports	Better Outcome	NPM1 mutations were associated with increased complete remission rates as well as longer overall disease free survival in normal karyotype AML patients >59 years old, particularly in those >69 years old	20026798	Becker et al., 2010, J. Clin. Oncol.	4
NPM1	4869	EXON 12	acute myeloid leukemia	9119	N/A		Prognostic	Supports	Better Outcome	NPM1 mutation was associated with higher complete remission rates, lower cumulative incidence of relapse and higher overall survival in intermediate risk AML patients	24855211	Linch et al., 2014, Blood	4
NPM1	4869	EXON 12	acute myeloid leukemia	9119	N/A		Prognostic	Supports	Poor Outcome	Coocurrence of FLT3-ITD mutations significantly reduced overall survival of normal karyotype AML patients	16455956	Thiede et al., 2006, Blood	4
NPM1	4869	EXON 12	acute myeloid leukemia	9119	N/A		Prognostic	Supports	Poor Outcome	Patients with NPM1 mutation and FLT3-ITD had reduced event-free survival compared to patients with wildtype FLT3	21537333	Schnittger et al., 2011, Leukemia	4
NPM1	4869	EXON 12	acute myeloid leukemia	9119	N/A		Prognostic	Supports	Poor Outcome	Using a ratio of FLT3-ITD/FLT3 wildtype levels as a continuous variable, a higher ratio was associated with reduced event-free survival in patients with an NPM1 mutation	21537333	Schnittger et al., 2011, Leukemia	4
NPM1	4869	W288FS	acute myeloid leukemia	9119	N/A		Diagnostic	Does Not Support	Negative	No NPM1 mutations were identified in patients with favorable risk cytogenetics (79/215 patients)	21067377	Ley et al., 2010, N. Engl. J. Med.	4
NPM1	4869	W288FS	acute myeloid leukemia	9119	N/A		Diagnostic	Supports	Positive	NPM1 mutations were associated with intermediate risk cytogenetics (including normal karyotype)	21067377	Ley et al., 2010, N. Engl. J. Med.	4
NPM1	4869	EXON 12	acute myeloid leukemia	9119	NSC348884		Predictive	Supports	Sensitivity	NSC348884 combined with ATRA treatment induces apoptosis in primary AML cells harboring mutant NPM1 but not cells with wildtype NPM1 or both mutant NPM1 and FLT3-ITD	21719597	Balusu et al., 2011, Blood	3
NPM1	4869	EXON 12	acute myeloid leukemia	9119	ATRA		Predictive	Supports	Sensitivity	NSC348884 combined with ATRA treatment induces apoptosis in primary AML cells harboring mutant NPM1 but not cells with wildtype NPM1 or both mutant NPM1 and FLT3-ITD	21719597	Balusu et al., 2011, Blood	3
NPM1	4869	EXON 12	acute myeloid leukemia	9119	ATRA		Predictive	Supports	Resistance or Non-Response	ATRA treatment did not effect overall survival in patients <60 years old with NPM1 mutation regardless of FLT3-ITD status	19965647	Burnett et al., 2010, Blood	3
NPM1	4869	EXON 12	acute myeloid leukemia	9119	N/A		Diagnostic	Does Not Support	Positive	Frequency of NPM1 mutations was not different in normal karyotype AML patients with CEPBA, NRAS or KIT mutations.	16076867	Schnittger et al., 2005, Blood	3
NPM1	4869	EXON 12	acute myeloid leukemia	9119	N/A		Diagnostic	Does Not Support	Negative	NPM1 mutations were not associated with M3 FAB subtype (0/55).	16455956	Thiede et al., 2006, Blood	3
NPM1	4869	EXON 12	acute myeloid leukemia	9119	N/A		Diagnostic	Supports	Positive	NPM1 mutations were associated with M5a and M5b FAB subtypes	16455956	Thiede et al., 2006, Blood	3
NPM1	4869	EXON 12	acute myeloid leukemia	9119	N/A		Diagnostic	Supports	Positive	NPM1 mutations were associated with normal karyotype in older (>60) patients	19059939	Schlenk et al., 2009, Haematologica	3
NPM1	4869	EXON 12	acute myeloid leukemia	9119	N/A		Predictive	Supports	Sensitivity	Patients with NPM1 mutations were associated with improved complete remission rates as well as overall and disease free survival when all ages and karyotype were analyzed; however, when only normal karyotype patients were analyzed, only complete remission rates were improved	19059939	Schlenk et al., 2009, Haematologica	3
NPM1	4869	EXON 12	acute myeloid leukemia	9119	N/A		Prognostic	Does Not Support	N/A	Mutation status of IDH1 did not change event-free survival of patients with an NPM1 mutation	20805365	Schnittger et al., 2010, Blood	3
NPM1	4869	EXON 12	acute myeloid leukemia	9119	N/A		Prognostic	Supports	Better Outcome	Complete remission rates were higher and both disease-free and overall survival was longer for patients with Exon 12 NPM1  .	16455956	Thiede et al., 2006, Blood	3
NPM1	4869	EXON 12	acute myeloid leukemia	9119	N/A		Prognostic	Supports	Better Outcome	Event-free survival was significantly improved in patients with both NPM1 and FLT3-TKD mutations compared to patients with 1) FLT3-TKD mutations alone 2) either NPM1 or FLT3-TKD when FLT3-ITD patients were excluded from the analysis 3) neither FLT3-TKD or NPM1 mutations or FLT3-TKD alone when only de novo, normal karyotype patients were analyzed	17965322	Bacher et al., 2008, Blood	3
NPM1	4869	EXON 12	acute myeloid leukemia	9119	N/A		Prognostic	Supports	Better Outcome	Normal karyotype patients with NPM1 mutation and without FLT3-ITD had improved overall and relapse-free survival, complete remission rates and remission duration compared to all other combinations of mutants	19047294	Büchner et al., 2009, J. Clin. Oncol.	3
NPM1	4869	EXON 12	acute myeloid leukemia	9119	N/A		Prognostic	Supports	Better Outcome	NPM1 mutation was associated with increased overall, event-free and relapse-free survival and remission after induction therapy in the entire cohort and in the cytogenetically normal subset of patients	22430270	Gaidzik et al., 2012, J. Clin. Oncol.	3
NPM1	4869	EXON 12	acute myeloid leukemia	9119	N/A		Prognostic	Supports	Poor Outcome	TET2 mutation reduces overall survival of normal karyotype patients with either an NPM1 mutation or NPM1 mutation without FLT3-ITD	24859829	Tian et al., 2014, Int. J. Hematol.	3
NPM1	4869	EXON 12	acute myeloid leukemia	9119	N/A		Prognostic	Supports	Poor Outcome	Patients with NPM1 mutations and low levels of FLT3-ITD have worse overall survival and cumulative incidence of relapse than those with NPM1 mutations alone in intermediate risk AML patients	24855211	Linch et al., 2014, Blood	3
NPM1	4869	W288FS	acute myeloid leukemia	9119	N/A		Predictive	Supports	Sensitivity	Mutation (Type A, W288fs) causes cytoplasmic localization of NPM when transfected into a non-hematopoietic cell line (293T cells). Cytoplasmic localization of NPM in AML patients was associated with good response to induction therapy.	15659725	Falini et al., 2005, N. Engl. J. Med.	3
NPM1	4869	EXON 12	acute myeloid leukemia	9119	ATRA		Predictive	Supports	Sensitivity	ATRA treatment improved overall and relapse-free survival in older (>60) patients with mutant NPM1 and without FLT3-ITD	19059939	Schlenk et al., 2009, Haematologica	2
NPM1	4869	EXON 12	acute myeloid leukemia	9119	Daunorubicin		Predictive	Supports	Sensitivity	Young patients (18-60) with NPM1 mutations had improved overall survival following high-dose versus standard dose daunorubicin (p=0.01) in univariate analysis. However, the adjusted p-value for multiple testing is 0.11.	22417203	Patel et al., 2012, N. Engl. J. Med.	2
NPM1	4869	EXON 12	acute myeloid leukemia	9119	Valproic acid		Predictive	Supports	Sensitivity	For patients with NPM1 mutation that achieved CR following induction therapy, relapse-free survival was improved following treatment with valproic acid	24797300	Tassara et al., 2014, Blood	2
NPM1	4869	EXON 12	acute myeloid leukemia	9119	N/A		Diagnostic	Supports	Positive	NPM1 mutations were associated with de novo AML as well as M4 and M5 FAB subtypes	17957027	Gale et al., 2008, Blood	2
NPM1	4869	EXON 12	acute myeloid leukemia	9119	N/A		Predictive	Supports	Resistance or Non-Response	Monitoring NPM1 mutation by cDNA-based RT-PCR effectively predicted relapse in 62/93 patients by >1 log increase in NPM1 levels (N=57) or lack of reduction in NPM1 levels following first line therapy (N=15)	19587375	Schnittger et al., 2009, Blood	2
NPM1	4869	EXON 12	acute myeloid leukemia	9119	N/A		Predictive	Supports	Sensitivity	Intermediate risk patients with mutant NPM1 had improved overall survival with the presence either IDH1 or IDH2 mutations than those wildtype for both IDH1 and IDH2	22417203	Patel et al., 2012, N. Engl. J. Med.	2
NPM1	4869	EXON 12	acute myeloid leukemia	9119	N/A		Predictive	Supports	Sensitivity	CD33 expression was significantly increased in patients with NPM1 mutation with or without FLT3-ITD, indicating these patients may respond to anti-CD33 therapy	24927407	Ehninger et al., 2014, Blood Cancer J	2
NPM1	4869	EXON 12	acute myeloid leukemia	9119	N/A		Predictive	Supports	Sensitivity	CD33 and CD123 expression was significantly increased in patients with NPM1 mutation with FLT3-ITD, indicating these patients may respond to combined anti-CD33 and anti-CD123 therapy	24927407	Ehninger et al., 2014, Blood Cancer J	2
NPM1	4869	EXON 12	acute myeloid leukemia	9119	N/A		Prognostic	Supports	Better Outcome	NPM1 mutation without FLT3-ITD was significantly associated with complete remission	18450602	Schlenk et al., 2008, N. Engl. J. Med.	3
BRAF	673	V600E	melanoma	1909	N/A		Predictive	Does Not Support	N/A	In the setting of BRAF(V600E), NF1 loss resulted in elevated activation of RAS-GTP but does not show resistance to MEK inhibitors.	24576830	Nissan et al., 2014, Cancer Res.	3
BRAF	673	V600E	melanoma	1909	N/A		Predictive	Supports	Resistance or Non-Response	In the setting of BRAF(V600E), NF1 loss resulted in elevated activation of RAS-GTP and resistance to RAF inhibitors.	24576830	Nissan et al., 2014, Cancer Res.	3
RET	5979	C634W	thyroid medullary carcinoma	3973	Motesanib		Predictive	Supports	Resistance or Non-Response	Medullary thyroid cancer cells with RET C634W mutation are insensitive to motesanib, compared to wild-type RET.	21422803	Coxon et al., 2012, J. Endocrinol. Invest.	3
RET	5979	M918T	thyroid medullary carcinoma	3973	Motesanib		Predictive	Supports	Resistance or Non-Response	Medullary thyroid cancer cells with RET M918T mutation are insensitive to motesanib, compared to wild-type RET.	21422803	Coxon et al., 2012, J. Endocrinol. Invest.	3
ABL1	25	BCR-ABL T315I	chronic myeloid leukemia	8552	Imatinib		Predictive	Supports	Resistance or Non-Response	In patients with the ABL T315I mutation, tumors have shown to be resistant to imatinib treatment.	20537386	An et al., 2010, Leuk. Res.	4
FGFR2	2263	FGFR2-MGEA5	cholangiocarcinoma	4947	Ponatinib		Predictive	Supports	Sensitivity	In a single patient with this fusion in intrahepatic cholangiocarcinoma. Ponatinib treatment resulted in "anti-tumor activitiy".	24550739	Borad et al., 2014, PLoS Genet.	3
FGFR2	2263	FGFR2-AFF3	breast cancer	1612	Pazopanib		Predictive	Supports	Sensitivity	In cell lines harboring this fusion, pazopanib exhibited anti-neoplastic properties.	23558953	Wu et al., 2013, Cancer Discov	3
FGFR2	2263	FGFR2-CASP7	breast cancer	1612	Pazopanib		Predictive	Supports	Sensitivity	In cell lines harboring this fusion, pazopanib exhibited anti-neoplastic properties.	23558953	Wu et al., 2013, Cancer Discov	3
FGFR2	2263	FGFR2-CCDC6	breast cancer	1612	Pazopanib		Predictive	Supports	Sensitivity	In cell lines harboring this fusion, pazopanib exhibited anti-neoplastic properties.	23558953	Wu et al., 2013, Cancer Discov	3
FGFR2	2263	FGFR2-BICC1	cholangiocarcinoma	4947	Pazopanib		Predictive	Supports	Sensitivity	In cell lines harboring this fusion, pazopanib exhibited anti-neoplastic properties.	23558953	Wu et al., 2013, Cancer Discov	3
FGFR2	2263	FGFR2-SLC45A3	prostate cancer	10283	Pazopanib		Predictive	Supports	Sensitivity	In cell lines harboring this fusion, pazopanib exhibited anti-neoplastic properties.	23558953	Wu et al., 2013, Cancer Discov	3
FGFR2	2263	FGFR2-KIAA1967	lung squamous cell carcinoma	3907	Pazopanib		Predictive	Supports	Sensitivity	In cell lines harboring this fusion, pazopanib exhibited anti-neoplastic properties.	23558953	Wu et al., 2013, Cancer Discov	3
FGFR2	2263	FGFR2-OFD1	thyroid cancer	1781	Pazopanib		Predictive	Supports	Sensitivity	In cell lines harboring this fusion, pazopanib exhibited anti-neoplastic properties.	23558953	Wu et al., 2013, Cancer Discov	3
FGFR3	2261	FGFR3-TACC3	bladder carcinoma	4007	Pazopanib		Predictive	Supports	Sensitivity	In a 50 year old male patient with this fusion in intrahepatic cholangiocarcinoma. Both pazopanib and ponatinib separately resulted in minor "tumor shrinkage". This fusion is also shown to be reccurent in multiple other cancer types.	24550739	Borad et al., 2014, PLoS Genet.	3
FGFR3	2261	FGFR3-TACC3	bladder carcinoma	4007	Ponatinib		Predictive	Supports	Sensitivity	In a 50 year old male patient with this fusion in intrahepatic cholangiocarcinoma. Both pazopanib and ponatinib separately resulted in minor "tumor shrinkage". This fusion is also shown to be reccurent in multiple other cancer types.	24550739	Borad et al., 2014, PLoS Genet.	3
FGFR3	2261	FGFR3-TACC3	cholangiocarcinoma	4947	Pazopanib		Predictive	Supports	Sensitivity	In a 50 year old male patient with this fusion in intrahepatic cholangiocarcinoma. Both pazopanib and ponatinib separately resulted in minor "tumor shrinkage". This fusion is also shown to be reccurent in multiple other cancer types.	24550739	Borad et al., 2014, PLoS Genet.	3
FGFR3	2261	FGFR3-TACC3	cholangiocarcinoma	4947	Ponatinib		Predictive	Supports	Sensitivity	In a 50 year old male patient with this fusion in intrahepatic cholangiocarcinoma. Both pazopanib and ponatinib separately resulted in minor "tumor shrinkage". This fusion is also shown to be reccurent in multiple other cancer types.	24550739	Borad et al., 2014, PLoS Genet.	3
FGFR3	2261	FGFR3-TACC3	glioblastoma multiforme	3068	Pazopanib		Predictive	Supports	Sensitivity	In a 50 year old male patient with this fusion in intrahepatic cholangiocarcinoma. Both pazopanib and ponatinib separately resulted in minor "tumor shrinkage". This fusion is also shown to be reccurent in multiple other cancer types.	24550739	Borad et al., 2014, PLoS Genet.	3
FGFR3	2261	FGFR3-TACC3	glioblastoma multiforme	3068	Ponatinib		Predictive	Supports	Sensitivity	In a 50 year old male patient with this fusion in intrahepatic cholangiocarcinoma. Both pazopanib and ponatinib separately resulted in minor "tumor shrinkage". This fusion is also shown to be reccurent in multiple other cancer types.	24550739	Borad et al., 2014, PLoS Genet.	3
FGFR3	2261	FGFR3-TACC3	oral cavity cancer	8618	Pazopanib		Predictive	Supports	Sensitivity	In a 50 year old male patient with this fusion in intrahepatic cholangiocarcinoma. Both pazopanib and ponatinib separately resulted in minor "tumor shrinkage". This fusion is also shown to be reccurent in multiple other cancer types.	24550739	Borad et al., 2014, PLoS Genet.	3
FGFR3	2261	FGFR3-TACC3	oral cavity cancer	8618	Ponatinib		Predictive	Supports	Sensitivity	In a 50 year old male patient with this fusion in intrahepatic cholangiocarcinoma. Both pazopanib and ponatinib separately resulted in minor "tumor shrinkage". This fusion is also shown to be reccurent in multiple other cancer types.	24550739	Borad et al., 2014, PLoS Genet.	3
FGFR3	2261	FGFR3-TACC3	cholangiocarcinoma	4947	Pazopanib		Predictive	Supports	Sensitivity	In a 50 year old male patient with this fusion in intrahepatic cholangiocarcinoma. Both pazopanib and ponatinib separately resulted in minor "tumor shrinkage". This fusion is also shown to be reccurent in multiple other cancer types.	24550739	Borad et al., 2014, PLoS Genet.	3
FGFR3	2261	FGFR3-TACC3	cholangiocarcinoma	4947	Ponatinib		Predictive	Supports	Sensitivity	In a 50 year old male patient with this fusion in intrahepatic cholangiocarcinoma. Both pazopanib and ponatinib separately resulted in minor "tumor shrinkage". This fusion is also shown to be reccurent in multiple other cancer types.	24550739	Borad et al., 2014, PLoS Genet.	3
FGFR3	2261	FGFR3-TACC3	lung squamous cell carcinoma	3907	Pazopanib		Predictive	Supports	Sensitivity	In a 50 year old male patient with this fusion in intrahepatic cholangiocarcinoma. Both pazopanib and ponatinib separately resulted in minor "tumor shrinkage". This fusion is also shown to be reccurent in multiple other cancer types.	24550739	Borad et al., 2014, PLoS Genet.	3
FGFR3	2261	FGFR3-TACC3	lung squamous cell carcinoma	3907	Ponatinib		Predictive	Supports	Sensitivity	In a 50 year old male patient with this fusion in intrahepatic cholangiocarcinoma. Both pazopanib and ponatinib separately resulted in minor "tumor shrinkage". This fusion is also shown to be reccurent in multiple other cancer types.	24550739	Borad et al., 2014, PLoS Genet.	3
KIT	3815	D816V	acute myeloid leukemia	9119	N/A		Prognostic	Supports	Poor Outcome	In acute myloid leukemia patients, D816 mutation is associated with earlier relapse and poorer prognosis than wildtype KIT	16384925	Cairoli et al., 2006, Blood	4
KIT	3815	L576P	melanoma	1909	Imatinib		Predictive	Supports	Resistance or Non-Response	The melanoma cell line WM3211, which harbors the L576P mutation, is not sensitive to imatinib, nilotinib, and sorafenib. Molecular modeling indicated the L576P mutation alters the conformation of KIT and reduces the binding affinity of imatinib.	19671763	Woodman et al., 2009, Mol. Cancer Ther.	3
KIT	3815	L576P	melanoma	1909	Nilotinib		Predictive	Supports	Resistance or Non-Response	The melanoma cell line WM3211, which harbors the L576P mutation, is not sensitive to imatinib, nilotinib, and sorafenib. Molecular modeling indicated the L576P mutation alters the conformation of KIT and reduces the binding affinity of imatinib.	19671763	Woodman et al., 2009, Mol. Cancer Ther.	3
KIT	3815	L576P	melanoma	1909	Sorafenib		Predictive	Supports	Resistance or Non-Response	The melanoma cell line WM3211, which harbors the L576P mutation, is not sensitive to imatinib, nilotinib, and sorafenib. Molecular modeling indicated the L576P mutation alters the conformation of KIT and reduces the binding affinity of imatinib.	19671763	Woodman et al., 2009, Mol. Cancer Ther.	3
KIT	3815	L576P	non-small cell lung carcinoma	3908	Dasatinib		Predictive	Supports	Sensitivity	BaF3 cells harboring KIT L576P mutation are sensitive to dasantinib, nilotinib and imatinib.	17372901	Antonescu et al., 2007, Int. J. Cancer	3
KIT	3815	L576P	non-small cell lung carcinoma	3908	Imatinib		Predictive	Supports	Sensitivity	BaF3 cells harboring KIT L576P mutation are sensitive to dasantinib, nilotinib and imatinib.	17372901	Antonescu et al., 2007, Int. J. Cancer	3
KIT	3815	L576P	non-small cell lung carcinoma	3908	Nilotinib		Predictive	Supports	Sensitivity	BaF3 cells harboring KIT L576P mutation are sensitive to dasantinib, nilotinib and imatinib.	17372901	Antonescu et al., 2007, Int. J. Cancer	3
KIT	3815	V654A	gastrointestinal stromal tumor	9253	SU11248		Predictive	Supports	Sensitivity	In GIST tumor cells and patients harboring KIT V654A mutation, SU11248 is effective for those that are refractory to imatinib.	16638875	Prenen et al., 2006, Clin. Cancer Res.	3
KIT	3815	L576P	melanoma	1909	Dasatinib		Predictive	Supports	Sensitivity	The melanoma cell line WM3211, which harbors the L576P mutation, is sensitive to dasatinib. Molecular modeling indicated the L576P mutation alters the conformation of KIT but did not alter the binding affinity of dasatinib.	19671763	Woodman et al., 2009, Mol. Cancer Ther.	3
KIT	3815	V654A	gastrointestinal stromal tumor	9253	Imatinib		Predictive	Supports	Resistance or Non-Response	KIT V654A results in imatinib resistance in GIST patient-derived cell lines.	16954519	Heinrich et al., 2006, J. Clin. Oncol.	3
KIT	3815	L576P	melanoma	1909	Imatinib		Predictive	Supports	Sensitivity	In a case study, a patient with anal melanoma harboring an exon 11 KIT mutation showed marked response 4 months after imatinib treatment.	18421059	Hodi et al., 2008, J. Clin. Oncol.	3
ESR1	2099	L536Q	breast cancer	1612	Tamoxifen		Predictive	Supports	Sensitivity	5 ligand binding domain mutations have been shown to result in constitutive activity and continued responsiveness to anti-estrogen therapies in vitro.	24185510	Robinson et al., 2013, Nat. Genet.	5
ESR1	2099	L536Q	breast cancer	1612	Fulvestrant		Predictive	Supports	Sensitivity	5 ligand binding domain mutations have been shown to result in constitutive activity and continued responsiveness to anti-estrogen therapies in vitro.	24185510	Robinson et al., 2013, Nat. Genet.	5
ESR1	2099	N538G	breast cancer	1612	Tamoxifen		Predictive	Supports	Sensitivity	5 ligand binding domain mutations have been shown to result in constitutive activity and continued responsiveness to anti-estrogen therapies in vitro.	24185510	Robinson et al., 2013, Nat. Genet.	5
ESR1	2099	N538G	breast cancer	1612	Fulvestrant		Predictive	Supports	Sensitivity	5 ligand binding domain mutations have been shown to result in constitutive activity and continued responsiveness to anti-estrogen therapies in vitro.	24185510	Robinson et al., 2013, Nat. Genet.	5
ESR1	2099	Y537C	breast cancer	1612	Tamoxifen		Predictive	Supports	Sensitivity	5 ligand binding domain mutations have been shown to result in constitutive activity and continued responsiveness to anti-estrogen therapies in vitro.	24185510	Robinson et al., 2013, Nat. Genet.	5
ESR1	2099	Y537C	breast cancer	1612	Fulvestrant		Predictive	Supports	Sensitivity	5 ligand binding domain mutations have been shown to result in constitutive activity and continued responsiveness to anti-estrogen therapies in vitro.	24185510	Robinson et al., 2013, Nat. Genet.	5
