gene	entrez_id	variant	disease	doid	drug	pubchem_id	evidence_type	evidence_direction	clinical_significance	statement	pubmed_id	citation	rating
PDGFRA	5156	D842V	gastrointestinal stromal tumor	9253	Crenolanib		Predictive	Supports	Sensitivity	In CHO cells with PDGFRA D842V mutation resulting in imatinib resistance, crenolanib showed relatively high potency.	22745105	Heinrich et al., 2012, Clin. Cancer Res.	4
PDGFRA	5156	D842Y	gastrointestinal stromal tumor	9253	Crenolanib		Predictive	Supports	Sensitivity	In CHO cells with PDGFRA D842Y mutation resulting in imatinib resistance, crenolanib showed relatively high potency.	22745105	Heinrich et al., 2012, Clin. Cancer Res.	4
PDGFRA	5156	DEL I843	gastrointestinal stromal tumor	9253	Crenolanib		Predictive	Supports	Sensitivity	In CHO cells with PDGFRA deletion I843 mutation resulting in imatinib resistance, crenolanib showed relatively high potency.	22745105	Heinrich et al., 2012, Clin. Cancer Res.	4
PDGFRA	5156	DI842-843IM	gastrointestinal stromal tumor	9253	Crenolanib		Predictive	Supports	Sensitivity	In CHO cells with PDGFRA DI842-843IM mutation resulting in imatinib resistance, crenolanib showed relatively high potency.	22745105	Heinrich et al., 2012, Clin. Cancer Res.	4
PDGFRA	5156	D842V	gastrointestinal stromal tumor	9253	Imatinib		Predictive	Supports	Resistance or Non-Response	While cancer with PVGFRA V561D mutation is known to be sensitive to Imatinib, double mutation of V561D and D842V mutants are resistant to imatinib.	16954519	Heinrich et al., 2006, J. Clin. Oncol.	4
PDGFRA	5156	D842V	gastrointestinal stromal tumor	9253	Imatinib		Predictive	Supports	Resistance or Non-Response	GIST cancer with D842V mutation is resistant to imatinib.	15928335	Corless et al., 2005, J. Clin. Oncol.	4
PDGFRA	5156	D842V	gastrointestinal stromal tumor	9253	N/A		Diagnostic	Supports	Negative	GIST tumor harboring PDGFRA D842V mutation are likely to be benign	15146165	Lasota et al., 2004, Lab. Invest.	3
NRAS	4893	Q61	melanoma	1909	Vemurafenib		Predictive	Supports	Resistance or Non-Response	Vemurafenib resistance is associated with gain of Q61 mutation in NRAS.	23569304	Trunzer et al., 2013, J. Clin. Oncol.	4
NRAS	4893	Q61	colorectal cancer	9256	Cetuximab		Predictive	Does Not Support	N/A	In chemotherapy-refractory patients with colorectal cancer, NRAS mutation status (primarily Q61) was not informative for disease control rate, progression free survival or overall survival following cetuximab plus chemotherapy.	20619739	De Roock et al., 2010, Lancet Oncol.	3
NRAS	4893	Q61	colorectal cancer	9256	Cetuximab		Predictive	Supports	Resistance or Non-Response	Chemotherapy-refractory patients with colorectal cancer harboring NRAS mutation (primarily Q61) have a significantly lower response rate to cetuximab than patients wildtype for NRAS.	20619739	De Roock et al., 2010, Lancet Oncol.	3
NRAS	4893	EXON 2	acute myeloid leukemia	9119	N/A		Prognostic	Does Not Support	N/A	The presence of NRAS mutation in AML patient does not impact diease prognosis (resistant disease, disease-free survival, complete remission rate, relapse rate, induction death)	15951308	Bowen et al., 2005, Blood	3
NRAS	4893	G12	acute myeloid leukemia	9119	N/A		Prognostic	Does Not Support	N/A	NRAS mutation status does not impact overall, event-free or disease-free survival in patients with AML	16434492	Bacher et al., 2006, Blood	3
NRAS	4893	EXON 2	colorectal cancer	9256	N/A		Prognostic	Supports	Poor Outcome	Patients with colorectal cancer harboring NRAS mutation has poorer survival outcome and worse prognosis.	24666267	Therkildsen et al., 2014, Acta Oncol	3
NRAS	4893	EXON 3	colorectal cancer	9256	N/A		Prognostic	Supports	Poor Outcome	Patients with colorectal cancer harboring NRAS mutation has poorer survival outcome and worse prognosis.	24666267	Therkildsen et al., 2014, Acta Oncol	3
NRAS	4893	EXON 4	colorectal cancer	9256	N/A		Prognostic	Supports	Poor Outcome	Patients with colorectal cancer harboring NRAS mutation has poorer survival outcome and worse prognosis.	24666267	Therkildsen et al., 2014, Acta Oncol	3
NRAS	4893	EXON 1	melanoma	1909	N/A		Prognostic	Supports	Poor Outcome	In patients with stage IV melanoma, NRAS mutation was associated with reduced median survival compared to patients with wildtype NRAS	22180178	Jakob et al., 2012, Cancer	3
NRAS	4893	EXON 2	melanoma	1909	N/A		Prognostic	Supports	Poor Outcome	In patients with stage IV melanoma, NRAS mutation was associated with reduced median survival compared to patients with wildtype NRAS	22180178	Jakob et al., 2012, Cancer	3
NRAS	4893	Q61	melanoma	1909	N/A		Diagnostic	Supports	Positive	Melanoma associated with NRAS Q61 mutation was more often associated with those at the extremity than those at the trunk	23861977	Tschandl et al., 2013, PLoS ONE	3
NRAS	4893	G13D	melanoma	1909	17-AAG		Predictive	Supports	Sensitivity	Due to increased reliance of mutant NRAS on HSP90 for stabilization, inhibition of HSP90 by 17-AAG is shown to be effective in a patient with metastatic malignant melenoma with a NRAS G13D mutation	18375819	Banerji et al., 2008, Mol. Cancer Ther.	2
NRAS	4893	Q61L	melanoma	1909	Temozolomide 		Predictive	Supports	Sensitivity	In a melanoma patient with NRAS Q61L mutation, treatment with temozolomide resulted in disease free survival of 14 months	21576590	Soon et al., 2011, Arch Dermatol	2
NRAS	4893	Q61R	melanoma	1909	Temozolomide 		Predictive	Supports	Sensitivity	In a melanoma patient with Q61R mutation, treatment with temozolomide resulted in overall survival of 16 months	21576590	Soon et al., 2011, Arch Dermatol	2
NPM1	4869	EXON 12	acute myeloid leukemia	9119	N/A		Diagnostic	Supports	Positive	"AML with mutated NPM1" is a provisional entity in WHO classification of acute myeloid leukemia (AML). This mutation should be tested for in clinical trials and is recommended for testing in patients with cytogentically normal AML.	19357394	Vardiman et al., 2009, Blood	5
MGMT	4255	PROMOTER METHYLATION	glioblastoma multiforme	3068	Temozolomide		Predictive	Supports	Sensitivity	In a randomized clinical trial, patients with MGMT promoter methyaltion benefitted from temozolomide. This benefit was also methylation status dependent, as those without methylation did not see increase survival.	15758010	Hegi et al., 2005, N. Engl. J. Med.	5
MGMT	4255	PROMOTER METHYLATION	glioblastoma multiforme	3068	O(6)-benzylguanine		Predictive	Supports	Sensitivity	In patients lacking MGMT promoter methylation, the use of an MGMT inhibitor, such as O(6)-benzylguanine, in combination with alkylating agents (Carmustine) may be useful in treating patients with initial resistance to alkylating agents.	11070098	Esteller et al., 2000, N. Engl. J. Med.	4
MGMT	4255	PROMOTER METHYLATION	glioblastoma multiforme	3068	Carmustine		Predictive	Supports	Sensitivity	MGMT promoter methylation has been shown to confer sensitivity to alkylating agents, such as carmustine, in glioblastoma cells.	11070098	Esteller et al., 2000, N. Engl. J. Med.	4
KRAS	3845	EXON 1	colorectal cancer	9256	Cetuximab		Predictive	Supports	Resistance or Non-Response	Patients with colorectal cancer who harbor KRAS mutation have low response rate to cetuximab	16618717	Lièvre et al., 2006, Cancer Res.	4
KRAS	3845	G12D	non-small cell lung carcinoma	3908	NVP-BEZ235		Predictive	Supports	Sensitivity	The use of NVP-BEZ235 in conjunction with ARRY-142886, but not as monotherapy, in lung cancer model with KRAS G12D mutation led to marked tumor regression.	19029981	Engelman et al., 2008, Nat. Med.	4
KRAS	3845	G12D	non-small cell lung carcinoma	3908	ARRY-142886		Predictive	Supports	Sensitivity	The use of NVP-BEZ235 in conjunction with ARRY-142886, but not as monotherapy, in lung cancer model with KRAS G12D mutation led to marked tumor regression.	19029981	Engelman et al., 2008, Nat. Med.	4
KRAS	3845	G13D	colorectal cancer	9256	Cetuximab		Predictive	Supports	Resistance or Non-Response	Cells harboring KRAS G12V mutation were insensitive to cetuximab treatment in isogenic SW48 cells and in a mouse xenograft models	20978259	De Roock et al., 2010, JAMA	4
KRAS	3845	G13D	colorectal cancer	9256	Cetuximab		Predictive	Supports	Sensitivity	KRAS G13D mutation is associated with better response to Cetuximab with longer progression-free and overall survival in colorectal patients compared to other KRAS	20978259	De Roock et al., 2010, JAMA	4
KRAS	3845	G13D	colorectal cancer	9256	Cetuximab		Predictive	Supports	Sensitivity	Cells harboring KRAS G13D mutation were sensitive to cetuximab treatment in isogenic SW48 cells and in a mouse xenograft models	20978259	De Roock et al., 2010, JAMA	4
KRAS	3845	G13D	colorectal cancer	9256	Cetuximab		Prognostic	Supports	Better Outcome	KRAS G13D mutation is associated with better response to Cetuximab with longer progression-free and overall survival in colorectal patients compared to other KRAS	20978259	De Roock et al., 2010, JAMA	4
KRAS	3845	EXON 2	colorectal cancer	9256	Regorafenib		Predictive	Does Not Support	Sensitivity	KRAS mutation status was not predictive of response to regorafenib treatment in patients that had received standard therapy and progressed within 3 months of their last treatment	24559322	Sartore-Bianchi et al., 2014, Expert Rev Anticancer Ther	4
KRAS	3845	G12	colorectal cancer	9256	N/A		Prognostic	Does Not Support	N/A	In patients with stage III colorectal cancer undergoing chemotherapy, KRAS G12 mutation did not impact overall or disease free survival.	19934290	Ogino et al., 2009, Clin. Cancer Res.	4
KRAS	3845	EXON 2	non-small cell lung carcinoma	3908	Gefitinib		Predictive	Supports	Resistance or Non-Response	In NSCLC, exon 2 KRAS mutations were associated with resistance to the EGFR kinase inhibitors gefitinib and erlotinib	15696205	Pao et al., 2005, PLoS Med.	3
KRAS	3845	EXON 2	non-small cell lung carcinoma	3908	Erlotinib		Predictive	Supports	Resistance or Non-Response	In NSCLC, exon 2 KRAS mutations were associated with resistance to the EGFR kinase inhibitors gefitinib and erlotinib	15696205	Pao et al., 2005, PLoS Med.	3
KRAS	3845	G12/G13	colorectal cancer	9256	Cetuximab		Predictive	Supports	Resistance or Non-Response	KRAS mutations were significantly associated with lack of response to cetuximab in patients with advanced colorectal cancer	18202412	Lièvre et al., 2008, J. Clin. Oncol.	3
KRAS	3845	G12/G13	colorectal cancer	9256	Cetuximab		Predictive	Supports	Resistance or Non-Response	Chemotherapy-refractory patients with colorectal cancer harboring KRAS mutations (primarily G12/G13) had lower response and disease control rates and shorter progression free and overall survival following cetuximab plus chemotherapy than those with wildtype KRAS	20619739	De Roock et al., 2010, Lancet Oncol.	3
KRAS	3845	G12/G13	colorectal cancer	9256	N/A		Prognostic	Supports	Poor Outcome	KRAS mutations were significantly associated with reduced progression-free and overall survival in patients with advanced colorectal cancer	18202412	Lièvre et al., 2008, J. Clin. Oncol.	3
KRAS	3845	G12	leukemia	1240	N/A		Diagnostic	Supports	Positive	Children with early age leukaemia who had second hand smoke exposure are more likely to harbor KRAS mutation.	24571676	Andrade et al., 2014, BMC Cancer	3
KRAS	3845	G13	leukemia	1240	N/A		Diagnostic	Supports	Positive	Children with early age leukaemia who had second hand smoke exposure are more likely to harbor KRAS mutation.	24571676	Andrade et al., 2014, BMC Cancer	3
KRAS	3845	G12D	lung cancer	1324	N/A		Diagnostic	Supports	Positive	KRAS G12D mutation occurs in never smokers significantly more often than in smokers	23014527	Dogan et al., 2012, Clin. Cancer Res.	3
KRAS	3845	G12	multiple myeloma	9538	N/A		Prognostic	Supports	Poor Outcome	The presence of KRAS mutations in MM patients is prognostic for shorter overall and progression free survival	18528420	Chng et al., 2008, Leukemia	3
KRAS	3845	G13	acute myeloid leukemia	9119	N/A		Prognostic	Supports	Poor Outcome	The presence of KRAS mutations in MM patients is prognostic for shorter overall and progression free survival	18528420	Chng et al., 2008, Leukemia	3
KRAS	3845	G12	non-small cell lung carcinoma	3908	N/A		Diagnostic	Does Not Support	Positive	KRAS mutations in lung patients are not associated with smoking history, age and gender	18794081	Riely et al., 2008, Clin. Cancer Res.	3
KRAS	3845	G12	non-small cell lung carcinoma	3908	N/A		Prognostic	Does Not Support	N/A	There is no strong association between KRAS mutation status and overall or progression free survival in patients with NSCLC	11208838	Schiller et al., 2001, J. Clin. Oncol.	3
KRAS	3845	G12	non-small cell lung carcinoma	3908	N/A		Prognostic	Supports	Poor Outcome	A meta-analysis showed KRAS mutation is associated with worse outcome in patients with NSCLC	15597105	Mascaux et al., 2005, Br. J. Cancer	3
KRAS	3845	G13	non-small cell lung carcinoma	3908	N/A		Diagnostic	Does Not Support	Negative	KRAS mutations in lung patients are not associated with smoking history, age and gender	18794081	Riely et al., 2008, Clin. Cancer Res.	3
KRAS	3845	G12D	non-small cell lung carcinoma	3908	Dabrafenib		Predictive	Supports	Resistance or Non-Response	In a patient with V600E-positive NSCLC, KRAS G12D seemed to confer resistance to dabrafenib.	23524406	Rudin et al., 2013, J Thorac Oncol	2
KRAS	3845	G12C	lung cancer	1324	N/A		Diagnostic	Supports	Positive	KRAS G12C occur more frequently in women than men	23014527	Dogan et al., 2012, Clin. Cancer Res.	2
KIT	3815	EXON 11	melanoma	1909	Imatinib		Prognostic	Supports	Better Outcome	Melanoma patients with KIT mutation but not KIT amplification showed response to imatinib treatment in a small cohort of patients.	23775962	Hodi et al., 2013, J. Clin. Oncol.	3
KIT	3815	EXON 13	melanoma	1909	Imatinib		Prognostic	Supports	Better Outcome	Melanoma patients with KIT mutation but not KIT amplification showed response to imatinib treatment in a small cohort of patients.	23775962	Hodi et al., 2013, J. Clin. Oncol.	3
KIT	3815	EXON 17	melanoma	1909	Imatinib		Prognostic	Supports	Better Outcome	Melanoma patients with KIT mutation but not KIT amplification showed response to imatinib treatment in a small cohort of patients.	23775962	Hodi et al., 2013, J. Clin. Oncol.	3
KIT	3815	EXON 11	gastrointestinal stromal tumor	9253	N/A		Prognostic	Does Not Support	N/A	KIT mutations were identified in morphologically benign, incidentally discovered GISTs at a rate similar to that seen in advanced, metastatic GIST patients indicating is not a prognostic marker for GIST	12000708	Corless et al., 2002, Am. J. Pathol.	3
KIT	3815	EXON 11	gastrointestinal stromal tumor	9253	N/A		Prognostic	Does Not Support	N/A	There is no significant association between KIT mutations in exon 11, exon 9 or wild type in survival among GIST patients.	16551858	Wardelmann et al., 2006, Clin. Cancer Res.	3
KIT	3815	EXON 11	gastrointestinal stromal tumor	9253	N/A		Prognostic	Supports	Poor Outcome	KIT mutation is associated with worse overall and cause-specific prognosis in patients with GIST compared to patients with wildtype KIT	10485475	Taniguchi et al., 1999, Cancer Res.	3
KIT	3815	EXON 14	gastrointestinal stromal tumor	9253	N/A		Prognostic	Supports	Poor Outcome	GIST patients with exon 14 KIT mutations had reduced overall survival compared to patients wiltype for KIT	16551858	Wardelmann et al., 2006, Clin. Cancer Res.	3
KIT	3815	EXON 17	gastrointestinal stromal tumor	9253	N/A		Diagnostic	Supports	Positive	KIT mutation is associated with larger, more invasive tumors, greater pathologic histology and older patients compared to tumors with wildtype KIT	10485475	Taniguchi et al., 1999, Cancer Res.	3
KIT	3815	EXON 9	gastrointestinal stromal tumor	9253	N/A		Prognostic	Does Not Support	N/A	There is no significant association between KIT mutations in exon 11, exon 9 or wild type in survival among GIST patients.	16551858	Wardelmann et al., 2006, Clin. Cancer Res.	3
KIT	3815	EXON 11	gastrointestinal stromal tumor	9253	N/A		Diagnostic	Supports	Positive	KIT mutation is associated with larger, more invasive tumors, greater pathologic histology and older patients compared to tumors with wildtype KIT	10485475	Taniguchi et al., 1999, Cancer Res.	2
KIT	3815	EXON 11	lung cancer	1324	N/A		Prognostic	Does Not Support	N/A	KIT mutations detected in 5/60 patients showed no prognostic significance in patients with small cell lung cancer	15217946	Boldrini et al., 2004, Clin. Cancer Res.	2
KIT	3815	EXON 9	lung cancer	1324	N/A		Prognostic	Does Not Support	N/A	KIT mutations detected in 5/60 patients showed no prognostic significance in patients with small cell lung cancer	15217946	Boldrini et al., 2004, Clin. Cancer Res.	2
JAK2	3717	V617F	polycythemia vera	8997	Pegylated IFN-α–2a		Predictive	Supports	Sensitivity	In patients with JAK2 V617F, the use of peglated IFN-alpha-2a leads to reduction in the percentage of cells harboring JAK2 V617F.	16709929	Kiladjian et al., 2006, Blood	4
JAK2	3717	V617F	chronic myeloid leukemia	8552	N/A		Diagnostic	Does Not Support	Positive	JAK2 V617F not associatted wth  lymphoid leukemia.	16081687	Levine et al., 2005, Blood	4
JAK2	3717	V617F	chronic myeloid leukemia	8552	N/A		Diagnostic	Supports	Positive	JAK2 V617F is associated with myeloid malignanices (AML, MDS, CMML/atypical CML).	16081687	Levine et al., 2005, Blood	4
JAK2	3717	V617F	lymphoid leukemia	10747	N/A		Diagnostic	Supports	Negative	JAK2 V617F is not associated with lymphoid leukemia (B-lineage ALL, T-ALL or CLL).	16081687	Levine et al., 2005, Blood	4
JAK2	3717	V617F	bone marrow cancer	4960	N/A		Diagnostic	Supports	Positive	rs10974944 SNP in the Jak2 locus is associated with increased predisposition for JAK2 V617F mutation and its associated cancer	19287384	Kilpivaara et al., 2009, Nat. Genet.	4
JAK2	3717	V617F	leukemia	1240	TG101348		Predictive	Supports	Sensitivity	TG101348 effectively inhibits STAT5 signaling in JAK2 V617F cells	18394554	Wernig et al., 2008, Cancer Cell	3
IDH2	3418	R140Q/L	acute myeloid leukemia	9119	N/A		Prognostic	Does Not Support	N/A	In patients with IDH2 R140Q/L mutation, the presence of mutation do not impact overall survival or disease free survival.	20421455	Thol et al., 2010, Blood	3
IDH2	3418	R140Q/L	acute myeloid leukemia	9119	N/A		Prognostic	Supports	Better Outcome	In AML, patients with IDH2 R140K mutation have improved overall survival compared to those with wild-type IDH2	21596855	Green et al., 2011, Blood	3
IDH2	3418	R172K	acute myeloid leukemia	9119	N/A		Prognostic	Supports	Poor Outcome	In AML, patients with IDH2 R172K mutation have worse overall survival compared to those with wild-type IDH2	21596855	Green et al., 2011, Blood	3
IDH2	3418	R140Q/L	myelodysplastic myeloproliferative cancer	4972	N/A		Prognostic	Does Not Support	N/A	R140Q mutation in IDH2 does not have prognostic value in patients with MDS.	22033490	Patnaik et al., 2012, Leukemia	3
IDH2	3418	R140Q/L	acute myeloid leukemia	9119	N/A		Prognostic	Does Not Support	N/A	AML patients with IDH2 mutations such as R140Q/L have event free survival and overall survival similar to those with wild-type IDH2	22616558	Zhou et al., 2012, Leuk. Lymphoma	2
IDH2	3418	R172K	acute myeloid leukemia	9119	N/A		Prognostic	Does Not Support	N/A	AML patients with IDH2 mutations such as R172K have event free survival and overall survival similar to those with wild-type IDH2.	22616558	Zhou et al., 2012, Leuk. Lymphoma	2
IDH2	3418	R140Q/L	myelodysplastic myeloproliferative cancer	4972	N/A		Prognostic	Does Not Support	N/A	In patients suffering from MDS, the presence of IDH2 mutation such as R140Q/L do not confer prognostic value (overall survival)	21997850	Lin et al., 2012, Ann. Hematol.	2
IDH2	3418	R172K	myelodysplastic myeloproliferative cancer	4972	N/A		Prognostic	Does Not Support	N/A	In patients suffering from MDS, the presence of IDH2 mutation such as R172K do not confer prognostic value (overall survival)	21997850	Lin et al., 2012, Ann. Hematol.	2
IDH1	3417	R132	astrocytoma	3069	N/A		Prognostic	Supports	Poor Outcome	IDH1 R132 mutation in patients suffering from myelodysplastic syndromes is associated with worse overall survival	20494930	Thol et al., 2010, Haematologica	4
IDH1	3417	R132C	acute myeloid leukemia	9119	N/A		Diagnostic	Supports	Positive	IDH1 R132 mutation is associated with patients of older age, high platelet count during diagnosis, cytogenic normalcy and NPM1 mutation	20538800	Abbas et al., 2010, Blood	3
IDH1	3417	R132H	acute myeloid leukemia	9119	N/A		Prognostic	Does Not Support	N/A	IDH1 R132 mutation in patients with AML is not associated with any prognostic value compared to patients with wild-type IDH1.	20538800	Abbas et al., 2010, Blood	3
IDH1	3417	R132L	acute myeloid leukemia	9119	N/A		Prognostic	Does Not Support	N/A	IDH1 R132 mutation in patients with AML is not associated with any prognostic value compared to patients with wild-type IDH1.	20538800	Abbas et al., 2010, Blood	3
IDH1	3417	R132	astrocytoma	3069	N/A		Prognostic	Supports	Better Outcome	In patients with astrocytoma, the presence of IDH1 R132 mutation is prognostic for better survival compared to patients who harbor wild type mutation.	19933982	Dubbink et al., 2009, Neurology	3
IDH1	3417	R132	glioblastoma multiforme	3068	N/A		Prognostic	Supports	Better Outcome	In patients with glioblastoma, those harboring IDH1 R132 mutation has higher overall survival compared to those who do not have IDH1 mutation	20127344	Bleeker et al., 2010, Acta Neuropathol.	3
IDH1	3417	R132	acute myeloid leukemia	9119	N/A		Diagnostic	Supports	Positive	In leukemia patients, IDH1 R132 mutation is associated with adults and normal karyotype.	20376086	Ho et al., 2010, Leukemia	2
IDH1	3417	R132	acute myeloid leukemia	9119	N/A		Prognostic	Does Not Support	N/A	The complete remission and overall survival rates in patients with IDH1 R132 mutation is not significantly different from those who do not have this mutation	20368538	Wagner et al., 2010, J. Clin. Oncol.	2
IDH1	3417	R132C	acute myeloid leukemia	9119	N/A		Prognostic	Does Not Support	N/A	IDH1 R132 mutation in patients with AML is not associated with any prognostic value compared to patients with wild-type IDH1.	20538800	Abbas et al., 2010, Blood	2
GATA2	2624	EXPRESSION	bronchogenic lung adenocarcinoma	3909	Bortezomib		Predictive	Supports	Sensitivity	Targeting overactive GATA2-mediated pathways with inhibitors bortezomib and fasudil led to dramatic tumor regression.	22624710	Barbacid, 2012, Cancer Cell	4
GATA2	2624	EXPRESSION	bronchogenic lung adenocarcinoma	3909	Fasudil		Predictive	Supports	Sensitivity	Targeting overactive GATA2-mediated pathways with inhibitors bortezomib and fasudil led to dramatic tumor regression.	22624710	Barbacid, 2012, Cancer Cell	4
FLT3	2322	ITD	acute myeloid leukemia	9119	N/A		Prognostic	Supports	Poor Outcome	In AML patients with FLT3-ITD  , concurrent DNMT3A mutations were associated with worse overall survival compared to those without DNMT3A mutation.	21067377	Ley et al., 2010, N. Engl. J. Med.	5
FLT3	2322	ITD	acute myeloid leukemia	9119	Sorafenib		Predictive	Supports	Sensitivity	Sorafenib is effective in patients with FLT3 internal tandem repeat , but not in wild type or D835 mutation.	18230792	Zhang et al., 2008, J. Natl. Cancer Inst.	4
FLT3	2322	TKD	acute myeloid leukemia	9119	Sorafenib		Predictive	Supports	Resistance or Non-Response	Emergence of D835 mutation in AML patients with FLT3 tandem repeat is associated with sorafenib resistance	22368270	Man et al., 2012, Blood	4
FLT3	2322	TKD	acute myeloid leukemia	9119	Sorafenib		Predictive	Supports	Resistance or Non-Response	Sorafenib is effective in patients with FLT3 internal tandem repeat , but not in wild type or D835 mutation.	18230792	Zhang et al., 2008, J. Natl. Cancer Inst.	4
FLT3	2322	ITD	acute myeloid leukemia	9119	CEP701		Predictive	Supports	Sensitivity	CEP701 is effective in AML patients with FLT3 mutation	14726387	Smith et al., 2004, Blood	4
FLT3	2322	TKD	acute myeloid leukemia	9119	CEP701		Predictive	Supports	Sensitivity	CEP701 is effective in AML patients with FLT3 mutation	14726387	Smith et al., 2004, Blood	4
FLT3	2322	ITD	acute myeloid leukemia	9119	AG1296		Predictive	Supports	Sensitivity	AG1296 is effective in triggering apoptosis in Ba/F3 and primary AML cells with FLT3 internal tandem repeat	12357354	Tse et al., 2002, Leukemia	4
FLT3	2322	ITD	acute myeloid leukemia	9119	N/A		Predictive	Supports	Resistance or Non-Response	FLT3-ITD mutation without NPM1 was associated with increased relapse risk and reduced overall survival in young adult AML patients (median age 43)	17957027	Gale et al., 2008, Blood	4
FLT3	2322	ITD	acute myeloid leukemia	9119	N/A		Prognostic	Does Not Support	N/A	In young AML patients (<60 years old), DNMT3A mutation status was not predictive of overall and relapse free survival in patients with NPM1 mutations and wildtype FLT3 or wildtype NPM1 and FLT3-ITD	22490330	Ribeiro et al., 2012, Blood	4
FLT3	2322	ITD	acute myeloid leukemia	9119	N/A		Prognostic	Does Not Support	N/A	FLT3-ITD duplication length did not effect prognosis in patients with an NPM1 mutation	21537333	Schnittger et al., 2011, Leukemia	4
FLT3	2322	ITD	acute myeloid leukemia	9119	N/A		Prognostic	Supports	Poor Outcome	Simultaneous tandem repeat of FLT3 with loss of wild type FLT3 leads to poor survival and inferior disease free survival in patients with AML.	11585760	Whitman et al., 2001, Cancer Res.	4
FLT3	2322	ITD	acute myeloid leukemia	9119	N/A		Prognostic	Supports	Poor Outcome	Patients with NPM1 mutation and FLT3-ITD had reduced event-free survival compared to patients with wildtype FLT3	21537333	Schnittger et al., 2011, Leukemia	4
FLT3	2322	ITD	acute myeloid leukemia	9119	N/A		Prognostic	Supports	Poor Outcome	Using a ratio of FLT3-ITD/FLT3 wildtype levels as a continuous variable, a higher ratio was associated with reduced event-free survival in patients with an NPM1 mutation	21537333	Schnittger et al., 2011, Leukemia	4
