gene	entrez_id	variant	disease	doid	drug	pubchem_id	evidence_type	evidence_direction	clinical_significance	statement	pubmed_id	citation	rating
FLT3	2322	ITD	acute myeloid leukemia	9119	N/A		Prognostic	Supports	Poor Outcome	A ratio of >0.49 FLT3-ITD/FLT3 wildtype level was associated with reduced event-free and overall survival in old (>59) and younger patients (<60) with an NPM1 mutation	21537333	Schnittger et al., 2011, Leukemia	4
FLT3	2322	TKD	acute myeloid leukemia	9119	N/A		Prognostic	Supports	Poor Outcome	In AML patients, FLT3-TKD mutation is associated with poorer disease free survival compared to patients with wild type FLT3	17940205	Whitman et al., 2008, Blood	4
FLT3	2322	ITD	acute myeloid leukemia	9119	SU5614		Predictive	Supports	Resistance or Non-Response	Ba/F3 cells with both FLT3-ITD and TKD mutations on the same allele have more resistance to the protein tyrosine kinase (PTK) inhibitor SU5614 than cells with FLT3-ITD alone or FLT3 ITD and TKD mutations on opposing alleles.	15626738	Bagrintseva et al., 2005, Blood	3
FLT3	2322	TKD	acute myeloid leukemia	9119	SU5614		Predictive	Supports	Resistance or Non-Response	Ba/F3 cells with both FLT3-ITD and TKD mutations on the same allele have more resistance to the protein tyrosine kinase (PTK) inhibitor SU5614 than cells with FLT3-ITD alone or FLT3 ITD and TKD mutations on opposing alleles.	15626738	Bagrintseva et al., 2005, Blood	3
FLT3	2322	ITD	acute myeloid leukemia	9119	ATRA		Predictive	Supports	Resistance or Non-Response	ATRA treatment did not effect overall survival in patients <60 years old with FLT3-ITD mutation	19965647	Burnett et al., 2010, Blood	3
FLT3	2322	ITD	acute myeloid leukemia	9119	Daunorubicin		Predictive	Supports	Resistance or Non-Response	Ba/F3 cells with both FLT3-ITD and TKD mutations on the same allele have more resistance to daunorubicin than cells with FLT3-ITD alone.	15626738	Bagrintseva et al., 2005, Blood	3
FLT3	2322	TKD	acute myeloid leukemia	9119	Daunorubicin		Predictive	Supports	Resistance or Non-Response	Ba/F3 cells with both FLT3-ITD and TKD mutations on the same allele have more resistance to daunorubicin than cells with FLT3-ITD alone.	15626738	Bagrintseva et al., 2005, Blood	3
FLT3	2322	ITD	acute myeloid leukemia	9119	N/A		Diagnostic	Supports	Positive	WBC counts were higher in AML patients with internal tandem repeat of Flt3 compared to wild type	11290608	Yamamoto et al., 2001, Blood	3
FLT3	2322	ITD	acute myeloid leukemia	9119	N/A		Predictive	Supports	Resistance or Non-Response	Increasing level of FLT3-ITD mutant correlated with reduced disease-free and overall survival as well as increased relapse rate	17957027	Gale et al., 2008, Blood	3
FLT3	2322	ITD	acute myeloid leukemia	9119	N/A		Prognostic	Supports	Poor Outcome	AML patients with internal tandem repeat of FLT3 has worse overall survival than patients with wild type FLT3	11290608	Yamamoto et al., 2001, Blood	3
FLT3	2322	TKD	acute myeloid leukemia	9119	N/A		Diagnostic	Does Not Support	Positive	WBC counts were not significantly different in AML patients with FLT3 D835 mutations compared to wild type	11290608	Yamamoto et al., 2001, Blood	3
FLT3	2322	TKD	acute myeloid leukemia	9119	N/A		Prognostic	Does Not Support	N/A	AML patients with D835 mutation of FLT3 did not have worse overall survival than patients with wild type FLT3	11290608	Yamamoto et al., 2001, Blood	3
FLT3	2322	TKD	acute myeloid leukemia	9119	N/A		Prognostic	Supports	Better Outcome	Event-free survival was significantly improved in patients with both NPM1 and FLT3-TKD mutations compared to patients with 1) FLT3-TKD mutations alone 2) either NPM1 or FLT3-TKD when FLT3-ITD patients were excluded from the analysis 3) neither FLT3-TKD or NPM1 mutations or FLT3-TKD alone when only de novo, normal karyotype patients were analyzed	17965322	Bacher et al., 2008, Blood	3
FLT3	2322	ITD	acute myeloid leukemia	9119	N/A		Prognostic	Does Not Support	N/A	Size of the FLT3-ITD mutant duplication had no impact on overall survival or relapse rate	17957027	Gale et al., 2008, Blood	2
FLT3	2322	ITD	acute myeloid leukemia	9119	N/A		Prognostic	Supports	Poor Outcome	Meta-analysis of studies involving cytogentically normal younger (<60) patients showed reduced overall and relapse-free survival for patients with FLT3-ITD	24801015	Port et al., 2014, Ann. Hematol.	2
ERBB2	2064	DEL 755-759	breast cancer	1612	Neratinib		Predictive	Supports	Sensitivity	All of these mutations were sensitive to the irreversible kinase inhibitor, neratinib.	23220880	Bose et al., 2013, Cancer Discov	5
ERBB2	2064	G309A	breast cancer	1612	Neratinib		Predictive	Supports	Sensitivity	All of these mutations were sensitive to the irreversible kinase inhibitor, neratinib.	23220880	Bose et al., 2013, Cancer Discov	5
ERBB2	2064	L755S	breast cancer	1612	Neratinib		Predictive	Supports	Sensitivity	All of these mutations were sensitive to the irreversible kinase inhibitor, neratinib.	23220880	Bose et al., 2013, Cancer Discov	5
ERBB2	2064	L755W	breast cancer	1612	Neratinib		Predictive	Supports	Sensitivity	All of these mutations were sensitive to the irreversible kinase inhibitor, neratinib.	23220880	Bose et al., 2013, Cancer Discov	5
ERBB2	2064	R678Q	breast cancer	1612	Neratinib		Predictive	Supports	Sensitivity	All of these mutations were sensitive to the irreversible kinase inhibitor, neratinib.	23220880	Bose et al., 2013, Cancer Discov	5
ERBB2	2064	V777L	breast cancer	1612	Neratinib		Predictive	Supports	Sensitivity	This mutation is sensitive to the irreversible kinase inhibitor, neratinib.	23220880	Bose et al., 2013, Cancer Discov	5
ERBB2	2064	V842I	breast cancer	1612	Neratinib		Predictive	Supports	Sensitivity	All of these mutations were sensitive to the irreversible kinase inhibitor, neratinib.	23220880	Bose et al., 2013, Cancer Discov	5
ERBB2	2064	D769H	breast cancer	1612	Neratinib		Predictive	Supports	Sensitivity	All of these mutations were sensitive to the irreversible kinase inhibitor, neratinib.	23220880	Bose et al., 2013, Cancer Discov	4
EGFR	1956	L858R	non-small cell lung carcinoma	3908	N/A		Predictive	Supports	Sensitivity	In NSCLC patients treated with tyrosine kinase inhibitors, the presence of L858R mutation is prognostic for better progression free survival.	24457318	Fukihara et al., 2014, Oncology	4
EGFR	1956	T790M	non-small cell lung carcinoma	3908	N/A		Prognostic	Supports	Poor Outcome	Patients with NSCLC harboring EGFR T790M mutation has statistically worse overall survival compared to patients with L858R or other exon 19 activating mutation.	24729716	Li et al., 2014, Onco Targets Ther	4
EGFR	1956	T790M	non-small cell lung carcinoma	3908	N/A		Prognostic	Supports	Poor Outcome	In NSCLC patients with T790M and another activating mutation, their progression free survival is shorter compared to those who do not possess T790M mutation.	24623981	Ding et al., 2014, Onco Targets Ther	4
EGFR	1956	T790M	non-small cell lung carcinoma	3908	Erlotinib		Predictive	Supports	Sensitivity	In a NSCLC patient with T790M and L858R mutation, combination treatment with erlotinib and premetrexed has shown to be effective.	24636847	Li et al., 2014, Lung Cancer	3
EGFR	1956	T790M	non-small cell lung carcinoma	3908	Premetrexed		Predictive	Supports	Sensitivity	In a NSCLC patient with T790M and L858R mutation, combination treatment with erlotinib and premetrexed has shown to be effective.	24636847	Li et al., 2014, Lung Cancer	3
EGFR	1956	L858R	non-small cell lung carcinoma	3908	Gefitinib		Predictive	Does Not Support	N/A	There is no statistical difference in progression free survival between lung cancer patients treated with gefitinib or erlotinib.	24736073	Lim et al., 2014, J Thorac Oncol	3
EGFR	1956	L858R	non-small cell lung carcinoma	3908	Erlotinib		Predictive	Does Not Support	N/A	There is no statistical difference in progression free survival between lung cancer patients treated with gefitinib or erlotinib.	24736073	Lim et al., 2014, J Thorac Oncol	3
EGFR	1956	L858R	non-small cell lung carcinoma	3908	Gefitinib		Predictive	Supports	Sensitivity	Geftinib added to pemetrexed and carboplatin showed greater effectiveness than premetrexed and carboplatin alone in treating NSCLC patients with L858R mutation.	24585406	Li et al., 2014, Ann. Surg. Oncol.	3
EGFR	1956	T790M	non-small cell lung carcinoma	3908	Gefitinib		Predictive	Supports	Resistance or Non-Response	In non-small cell lung cancer, the appearance of T790M mutation leads to resistance to gefitinib.	15728811	Kobayashi et al., 2005, N. Engl. J. Med.	3
EGFR	1956	L858R	non-small cell lung carcinoma	3908	N/A		Prognostic	Supports	Better Outcome	Median survival of patients with EGFR L858R mutation is better than those with wild type EGFR.	24662454	Douillard et al., 2014, J Thorac Oncol	3
EGFR	1956	T790M	non-small cell lung carcinoma	3908	Stauroporine		Predictive	Supports	Sensitivity	In NSCLC containing T790M mutation, staurosporine may be inhibitive of EGFR, especially when L858R mutation is also present.	24658966	Ai et al., 2014, Amino Acids	1
DNMT3A	1788	R882	acute myeloid leukemia	9119	N/A		Diagnostic	Supports	Positive	DNMT3A mutations (59% of which were R882) were associated with an intermediate risk cytogenetic profile, normal cytogenetic profile, and M4 and M5 FAB subtypes	21067377	Ley et al., 2010, N. Engl. J. Med.	5
DNMT3A	1788	R882	acute myeloid leukemia	9119	N/A		Prognostic	Supports	Poor Outcome	AML patients with DNMT3A mutations (59% of which were R882) showed worse survival (event-free and overall) outcome than those without DNMT3A mutation.	21067377	Ley et al., 2010, N. Engl. J. Med.	5
DNMT3A	1788	R882	acute myeloid leukemia	9119	N/A		Prognostic	Supports	Poor Outcome	In AML patients with FLT3-ITD  , concurrent DNMT3A mutations (including R882) were associated with worse overall survival compared to those without DNMT3A mutation.	21067377	Ley et al., 2010, N. Engl. J. Med.	5
DNMT3A	1788	R882	acute myeloid leukemia	9119	N/A		Prognostic	Supports	Poor Outcome	In cytogenetically normal AML patients, DNMT3A R882 mutations are associated with lower overall and disease free survival as compared to patients with wild type DNMT3A.	24512939	El Ghannam et al., Blood Cells Mol. Dis.	5
DNMT3A	1788	R882	acute myeloid leukemia	9119	Idarubicin		Predictive	Supports	Sensitivity	Idarubicin increases the overall survival and disease free survival in de novo AML patients with DNMT3A R882 mutation compared to those who do not harbor this mutation.	22081665	LaRochelle et al., 2011, Oncotarget	4
DNMT3A	1788	R882	acute myeloid leukemia	9119	Daunorubicin		Predictive	Does Not Support	NA	Daunorubicin treatment resulted in similar overall survival and disease free survival in de novo AML patients with DNMT3A R882 mutation compared to those who do not harbor this mutation.	22081665	LaRochelle et al., 2011, Oncotarget	4
DNMT3A	1788	R882	acute myeloid leukemia	9119	N/A		Prognostic	Does Not Support	N/A	Complete remission rates did not differ between patients with wildtype or mutant DNMT3A (62% of which affected R882) and cytogenetically normal AML	22291079	Marcucci et al., 2012, J. Clin. Oncol.	4
DNMT3A	1788	R882	acute myeloid leukemia	9119	N/A		Prognostic	Does Not Support	N/A	In young AML patients (<60 years old), DNMT3A mutation status (60% of which were R882) was not predictive of overall and relapse free survival in patients with NPM1 mutations and wildtype FLT3 or wildtype NPM1 and FLT3-ITD	22490330	Ribeiro et al., 2012, Blood	4
DNMT3A	1788	R882	acute myeloid leukemia	9119	N/A		Prognostic	Does Not Support	N/A	There is no difference in the complete remission rate of de novo AML patients with DNMT3A mutation compared to those who are wild type for DNMT3A.	22081665	LaRochelle et al., 2011, Oncotarget	4
DNMT3A	1788	R882	acute myeloid leukemia	9119	N/A		Prognostic	Supports	Poor Outcome	DNMT3A mutations (62% of which were R882) were associated with reduced disease-free survival in patients with cytogenetically normal AML.	22291079	Marcucci et al., 2012, J. Clin. Oncol.	4
DNMT3A	1788	R882	acute myeloid leukemia	9119	N/A		Prognostic	Supports	Poor Outcome	In young AML patients (<60 years old), DNMT3A mutations were associated with significantly reduced overall survival and relapse free survival in patients wildtype for NPM1 and FLT3	22490330	Ribeiro et al., 2012, Blood	4
DNMT3A	1788	R882	acute myeloid leukemia	9119	N/A		Prognostic	Supports	Poor Outcome	De novo AML patients with DNMT3A D882 mutation showed worse survival (event-free and overall) outcome than those without DNMT3A mutation.	21067377	Ley et al., 2010, N. Engl. J. Med.	4
DNMT3A	1788	R882	acute myeloid leukemia	9119	N/A		Prognostic	Supports	Poor Outcome	In older cytogenetically normal AML patients (>59 years), DNMT3A R882 mutation is prognostic for shorter disease free survival and overall survival compared to patients without the mutation.	22291079	Marcucci et al., 2012, J. Clin. Oncol.	4
DNMT3A	1788	R882	acute myeloid leukemia	9119	N/A		Prognostic	Supports	Poor Outcome	In younger cytogenetically normal AML patients (<60 years), DNMT3A mutations other than R882 are prognostic for shorter disease free survival and overall survival compared to patients without the mutation.	22291079	Marcucci et al., 2012, J. Clin. Oncol.	4
DNMT3A	1788	R882	acute myeloid leukemia	9119	N/A		Diagnostic	Supports	Positive	Young AML patients (<60 years old) with DNMT3A mutations (60% of which were R882) were older in age, had higher white blood cell counts and had higher platelet counts than patients wildtype for DNMT3A	22490330	Ribeiro et al., 2012, Blood	3
DNMT3A	1788	R882	acute myeloid leukemia	9119	N/A		Diagnostic	Supports	Positive	DNMT3A mutations (64.5% R882) were associated with older age, higher white blood cell count and cytogenetically normal AML in a large cohort of younger (18-60) AML patients	23632886	Gaidzik et al., 2013, Blood	3
DNMT3A	1788	R882	acute myeloid leukemia	9119	N/A		Diagnostic	Supports	Negative	Therapy-related AML was less common in patients with DNMT3A mutations (64.5% of which were R882) than patients wildtype for DNMT3A in a large cohort of younger (18-60) AML patients	23632886	Gaidzik et al., 2013, Blood	3
DNMT3A	1788	R882	acute myeloid leukemia	9119	N/A		Diagnostic	Supports	Positive	DNMT3A R882 mutations were associated with cytogenetically normal AML in a large cohort of younger (18-60) AML patients	23632886	Gaidzik et al., 2013, Blood	3
DNMT3A	1788	R882	acute myeloid leukemia	9119	N/A		Diagnostic	Supports	Positive	DNMT3A R882 mutations occur most often in de novo AML patients with intermediate cytogenic risk.	22081665	LaRochelle et al., 2011, Oncotarget	3
DNMT3A	1788	R882	acute myeloid leukemia	9119	N/A		Diagnostic	Supports	Positive	DNMT3A R882 mutations were associated with older age, higher white blood cell count, and FAB M4 and M5 subtypes compared to wildtype DNMT3A in a cohort of cytogenetically normal AML patients	24512939	El Ghannam et al., Blood Cells Mol. Dis.	3
DNMT3A	1788	R882	acute myeloid leukemia	9119	N/A		Prognostic	Does Not Support	N/A	In a large cohort of AML patients (mean = 48 years), DNMT3A mutation (64.5% of which were R882) had no prognostic value on overall, relapse free and event free survival.	23632886	Gaidzik et al., 2013, Blood	3
DNMT3A	1788	R882	acute myeloid leukemia	9119	N/A		Prognostic	Does Not Support	N/A	In a large cohort of cytogenetically normal AML patients (18-60 years old), DNMT3A mutation status (65.4% of which were R882) had no prognostic value for overall, relapse free and event free survival	23632886	Gaidzik et al., 2013, Blood	3
DNMT3A	1788	R882	acute myeloid leukemia	9119	N/A		Prognostic	Supports	Better Outcome	DNMT3A mutations were associated with achievement of complete remission in a large cohort of younger (18-60) AML patients	23632886	Gaidzik et al., 2013, Blood	3
DNMT3A	1788	R882	acute myeloid leukemia	9119	N/A		Prognostic	Supports	Poor Outcome	DNMT3A R882 mutation was associated with reduced relapse free and overall survival in ELN-unfavorable cytogenetically normal AMLs	23632886	Gaidzik et al., 2013, Blood	3
DNMT3A	1788	R882	acute myeloid leukemia	9119	N/A		Prognostic	Supports	Poor Outcome	Young AML patients (<60 years old) with DNMT3A mutation have shorter overall survival and relapse-free survival than patients with wildtype DNMT3A	22490330	Ribeiro et al., 2012, Blood	3
DNMT3A	1788	R882	acute myeloid leukemia	9119	N/A		Prognostic	Supports	Poor Outcome	Complete remission rate was not different between young AML patients (<60 years old) with or without DNMT3A mutations (60% of which were R882)	22490330	Ribeiro et al., 2012, Blood	3
DNMT3A	1788	R882	acute myeloid leukemia	9119	N/A		Prognostic	Supports	Poor Outcome	Young AML patients (<60 years old) with DNMT3A R882 mutations have shorter overall survival and relapse-free survival than patients with wildtype DNMT3A	22490330	Ribeiro et al., 2012, Blood	3
DNMT3A	1788	R882	acute myeloid leukemia	9119	N/A		Prognostic	Supports	Poor Outcome	In a large cohort of young AML patients (18-60 years old), DNMT3A R882 mutations were associated with reduced relapse free survival in the entire cohort as well as the subset of patients with cytogenetically normal AML	23632886	Gaidzik et al., 2013, Blood	3
CEBPA	1050	WHOLE GENE	acute myeloid leukemia	9119	N/A		Predictive	Does Not Support	N/A	CEBPA mutation status had no impact on ATRA treatment response in older (>60) patients with AML	19965647	Burnett et al., 2010, Blood	4
CEBPA	1050	WHOLE GENE	acute myeloid leukemia	9119	N/A		Prognostic	Supports	Better Outcome	CEBPA mutation was significantly associated with complete remission	18450602	Schlenk et al., 2008, N. Engl. J. Med.	4
CEBPA	1050	WHOLE GENE	acute myeloid leukemia	9119	N/A		Prognostic	Supports	Better Outcome	CEBPA mutation was associated with improved overall survival in older (>60) patients with AML	19965647	Burnett et al., 2010, Blood	4
CEBPA	1050	N-TERMINAL FRAME SHIFT	acute myeloid leukemia	9119	N/A		Prognostic	Supports	Better Outcome	Overall survival was significantly longer in younger (16-60), cytogenetically normal AML patients with CEBPA mutations	14726504	Fröhling et al., 2004, J. Clin. Oncol.	3
CEBPA	1050	N-TERMINAL FRAME SHIFT	acute myeloid leukemia	9119	N/A		Prognostic	Supports	Better Outcome	Remission duration was significantly longer in younger (16-60), cytogenetically normal AML patients with CEBPA	14726504	Fröhling et al., 2004, J. Clin. Oncol.	3
CEBPA	1050	N-TERMINAL FRAME SHIFT	acute myeloid leukemia	9119	N/A		Prognostic	Does Not Support	N/A	FLT3 mutations did not alter overall survival in younger (16-60), cytogenetically normal AML patients with CEBPA	14726504	Fröhling et al., 2004, J. Clin. Oncol.	2
CDKN2A	1029	PROMOTER HYPERMETHYLATION	non-small cell lung carcinoma	3908	N/A		Prognostic	Supports	Poor Outcome	In NSCLC patients younger than 60 years at age of diagnosis, p16 (CDKN2A) promoter hypermethylation is associated with shorter time to recurrence.	23111194	Bradly et al., 2012, Diagn. Mol. Pathol.	3
CDKN2A	1029	PROMOTER HYPERMETHYLATION	non-small cell lung carcinoma	3908	N/A		Prognostic	Supports	Poor Outcome	In NSCLC patients younger than 60 years at age of diagnosis, p16 (CDKN2A) promoter hypermethylation is associated with shorter overall survival.	23111194	Bradly et al., 2012, Diagn. Mol. Pathol.	3
CDK6	1021	EXPRESSION	estrogen-receptor positive breast cancer	0060075	BYL719		Predictive	Supports	Sensitivity	In a patient-derived xenograft of a PIK3CA mutant, the combination of PI3K and CDK 4/6 inhibitors overcomes intrinsic and adaptive resistance leading to tumor regressions.	25002028	Vora et al., 2014, Cancer Cell	4
CDK6	1021	EXPRESSION	estrogen-receptor positive breast cancer	0060075	Palbociclib		Prognostic	Supports	Better Outcome	Palbociclib has been shown to dramatically improve progression-free survival by over 18 months in patients with ER+ Breast Cancer.	23898052	Logan et al., 2013, Anticancer Res.	3
CDK4	1019	EXPRESSION	estrogen-receptor positive breast cancer	0060075	BYL719		Predictive	Supports	Sensitivity	In a patient-derived xenograft of a PIK3CA mutant, the combination of PI3K and CDK 4/6 inhibitors overcomes intrinsic and adaptive resistance leading to tumor regressions.	25002028	Vora et al., 2014, Cancer Cell	4
CDK4	1019	EXPRESSION	estrogen-receptor positive breast cancer	0060075	Palbociclib		Prognostic	Supports	Better Outcome	Palbociclib has been shown to dramatically improve progression-free survival by over 18 months in patients with ER+ Breast Cancer.	23898052	Logan et al., 2013, Anticancer Res.	3
CCNE1	898	OVEREXPRESSION	breast cancer	1612	N/A		Prognostic	Supports	Poor Outcome	Patients with high expression of total cyclin E and low-molecular weight cyclin E is strongly associated with poor prognosis in breast cancer, and the hazard ratio for these patients in 13.3 times higher than those with normal cyclin E levels.	12432043	Keyomarsi et al., 2002, N. Engl. J. Med.	4
CCNE1	898	OVEREXPRESSION	gastric adenosquamous carcinoma	5635	N/A		Prognostic	Supports	Poor Outcome	Elevated levels of CCNE1 mRNA has been shown to be correlated with advanced stage gastric carcinoma.	10224221	Donnellan et al., 1999, FASEB J.	4
CCNE1	898	OVEREXPRESSION	gastric adenosquamous carcinoma	5635	N/A		Prognostic	Supports	Poor Outcome	Elevated levels of CCNE1 mRNA has been shown to be correlated with increased depth of tumor invasion in gastic carcinoma.	10224221	Donnellan et al., 1999, FASEB J.	4
CCNE1	898	OVEREXPRESSION	lung cancer	1324	N/A		Prognostic	Supports	Poor Outcome	Elevated levels of CCNE1 mRNA has been shown to be correlated with increased depth of tumor invasion in gastic carcinoma.	10224221	Donnellan et al., 1999, FASEB J.	4
CCND3	896	LOSS	T-cell leukemia	715	Palbociclib (PD-0332991)		Predictive	Supports	Sensitivity	Treatment of Notch-driven T-cell leukemia in Ccnd3 knockout mice with Palbociclib (PD-0332991) significantly increased median survival.	23079656	Sawai et al., 2012, Cancer Cell	3
CCND2	894	OVEREXPRESSION	stomach cancer	10534	N/A		Prognostic	Supports	Poor Outcome	Cyclin D2 overexpression is associated with the presence pf lymph node metastasis in gastric cancers.	10547574	Takano et al., 1999, J. Pathol.	4
CCND2	894	OVEREXPRESSION	stomach cancer	10534	N/A		Prognostic	Supports	Poor Outcome	Cyclin D2 overexpression is associated with the increased depth of cancer invasion in gastric cancers.	10547574	Takano et al., 1999, J. Pathol.	4
CCND2	894	OVEREXPRESSION	stomach cancer	10534	N/A		Prognostic	Supports	Poor Outcome	Cyclin D2 overexpression is associated with poor prognosis in gastric cancers.	10547574	Takano et al., 1999, J. Pathol.	4
CCND2	894	OVEREXPRESSION	stomach cancer	10534	N/A		Prognostic	Supports	Poor Outcome	Cyclin D2 overexpression is associated with vascular invasion by cancer cells in gastric cancers.	10547574	Takano et al., 1999, J. Pathol.	4
CCND2	894	PROMOTER DEMETHYLATION	stomach cancer	10534	N/A		Diagnostic	Supports	Negative	CCND2 hypomethylation is seen to be more common in stage III and IV gastric tumors than stage I and II.	14612939	Oshimo et al., 2003, Int. J. Oncol.	3
CCND2	894	PROMOTER DEMETHYLATION	stomach cancer	10534	N/A		Predictive	Supports	Sensitivity	Treatment of CCND2-negative cells with 5-Aza-2'-deoxycytidine restored cyclin D2 expression.	14612939	Oshimo et al., 2003, Int. J. Oncol.	2
BRAF	673	V600E	melanoma	1909	Dabrafenib		Predictive	Supports	Sensitivity	dabrafenib with trametinib provides higher response rate and lower toxicity-as compared to chemotherapy-in patients with melanoma.	24583796	Menzies et al., 2014, Clin. Cancer Res.	5
BRAF	673	V600E	melanoma	1909	Trametinib		Predictive	Supports	Sensitivity	dabrafenib with trametinib provides higher response rate and lower toxicity-as compared to chemotherapy-in patients with melanoma.	24583796	Menzies et al., 2014, Clin. Cancer Res.	5
BRAF	673	V600E	colorectal cancer	9256	N/A		Prognostic	Supports	Poor Outcome	V600E is associated with adverse pathological features of colorectal cancer. This can be concluded as poor prognosis.	24594804	Chen et al., 2014, PLoS ONE	5
BRAF	673	V600E	thyroid cancer	1781	N/A		Diagnostic	Supports	Positive	thyroid nodule with BRAF V600E mutation is highly correlated with thyroid cancer.	24588959	Zhang et al., 2014, Diagn Pathol	5
BRAF	673	V600E	thyroid cancer	1781	N/A		Diagnostic	Supports	Positive	thyroid nodule with BRAF V600E mutation is highly correlated with thyroid cancer.	24570209	Crescenzi et al., 2014, Horm. Metab. Res.	5
BRAF	673	V600E	thyroid cancer	1781	N/A		Prognostic	Does Not Support	Poor Outcome	Unlike other studies that suggest a poorer outcome, BRAF mutation in this study was not correlated with poorer prognosis in papillary thyroid cancer.	24354346	Walczyk et al., 2014, Clin. Endocrinol. (Oxf)	5
BRAF	673	V600E AMPLIFICATION	colorectal cancer	9256	AZD6244		Predictive	Supports	Resistance or Non-Response	COLO201 and COLO206F cell harboring BRAF V600E mutations were cloned to be MEK inhibitor (AZD6244) resistant. The mechanim of this resistence was shown to be amplification of the BRAF V600E gene.	21098728	Corcoran et al., 2010, Sci Signal	4
BRAF	673	V600	melanoma	1909	N/A		Diagnostic	Supports	Positive	BRAF mutations are associated with melanoma arising in nonchronic sun damage skin and with superficial spreading melanoma	21166657	Lee et al., 2011, Br. J. Dermatol.	4
BRAF	673	V600	colorectal cancer	9256	Panitumumab		Predictive	Supports	Resistance or Non-Response	In metastatic colorectal cancer patients with wildtype KRAS, BRAF mutations were associated with poor progression free survival regardless of treatment (panitumumab with best supportive care or best supportive care alone)	23325582	Peeters et al., 2013, Clin. Cancer Res.	3
BRAF	673	V600E	colorectal cancer	9256	PD0325901		Predictive	Supports	Sensitivity	Combined PD0325901 and PLX4720 administration to NSG mice subcutanousely injected with colorectal cell lines with a BRAF V600E mutation effectively inhibited tumor growth and reduced cellular proliferation	23845441	Rad et al., 2013, Cancer Cell	3
